content,title
" La actualización a Android Nougat 7.0 ha comenzado. Si tienes uno de estos móviles pronto recibirás la versión más reciente de Android. No podía faltar. Después de que el Sony Xperia X Performance ya se encontrara recibiendo el turrón, y tras las pruebas en beta realizadas por el fabricante, también el Sony Xperia XZ se reserva una sorpresa para sus dueños. Algunos ya están reportando la llegada de Android 7.0 Nougat en forma de OTA.  Las fechas que barajaba finalmente el fabricante eran las de finales de noviembre, entra dentro del plazo. Aunque eso sí: la actualización se lanza de manera escalonada, como es habitual. Así que quizá tardes en recibirla dependiendo de la zona donde te encuentres. Las mejoras de Nougat para el Xperia XZ son las propias de Android 7.0. Accesos rápidos en los iconos del escritorio, mejor optimización de consumo gracias a Doze, también mejora el modo Stamina propio de Sony, se incluyen las notificaciones con interacción… Y se mantiene el diseño de la interfaz con el estilo tan cercano a Android Stock que ya estrenaron los primeros Sony Xperia X. Ya sabes: si tienes un Sony Xperia XZ pronto lo tendrás actualizado a Android 7.0 Nougat. La actualización pesa un total de 1.075,4 MB. Vía talk.SonyMobile Bien hecho por parte de Sony Lo único malo y no de parte de Sony, es que los Z3, que en un inicio tendrían Android 7.0, fueron dejados en el olvido por una simple modificación en el código por parte de Google. Fue una putada, hasta beta habia xd ojala liberasen todo el codigo fuente de ese movil (incluido el privativo de las camaras y el audio) para que la comunidad pueda completar el trabajo que estaba en su recta final. El Androide Libre / Blog de referencia Android en español.Noticias, aplicaciones, juegos, teléfonos móviles. Todo sobre Android el SO de Google: Nexus, Samsung, Root. Información Legal | Contacto El Androide Libre usa cookies para funcionar Aceptar Más info","<a href=""https://elandroidelibre.elespanol.com/2016/12/android-7-0-nougat-para-sony-xperia-xz.html"">Android 7.0 Nougat llega al Sony Xperia XZ</a>"
" Ya tenemos entre nosotros a todos los titanes de la gama alta de 2017, y ha llegado la hora de enfrentarlos. Comparamos el Samsung Galaxy S8, el LG G6, el Huawei P10 y el Sony Xperia XZ Premium. Aunque se ha hecho de rogar, ya tenemos aquí a toda la gama alta. Los buques insignia de Samsung, Huawei, Sony y LG ya están entre nosotros. China, Corea y Japón enfrentadas por tener el mejor dispositivo para enfrentar 2017. Y en El Androide Libre queremos ver quién parte con ventaja sobre el papel. Por eso, como podéis haber deducido de la introducción, vamos a comparar a todos estos dispositivos sobre el papel. Sabemos que lo que importa es cómo son en nuestra mano, pero esta comparativa nos dejará hacernos una idea de cómo se enfrentan. ¿Quién partirá con ventaja en este disputado duelo?  Empezamos por lo más visible del conjunto, la pantalla. La más pequeña nos la encontramos en el Huawei P10 (5.1 pulgadas), mientras que la mayor está en la versión Plus del Samsung Galaxy S8 (6.2 pulgadas). El 2K como resolución es la tónica general para todos, aunque el Xperia XZ Premium despunte subiendo hasta el 4K. Aunque quizás la apuesta más atrevida es la de Samsung y LG al confiar en la relación de aspecto 2:1 o 18:9. Es decir, la pantalla de los teléfonos coreanos es más alargada de lo habitual, una peculiaridad de las pantallas Univisium. Esto hace posible que ocupen más frontal, que aumente la pantalla sin aumentar el tamaño. Y, al haber apostado ambos por ello, lo harán más fabricantes.  En procesadores nos encontramos pocas sorpresas. Samsung continúa con su modus operandi y lanzará dos versiones, una con su procesador Exynos y otra con uno de los últimos Qualcomm. El Xperia también estrenará el Snapdragon 835. Huawei sigue en sus trece y usa su propio Kirin. Y, como nota extraña, LG ha preferido usar el “antiguo” Snapdragon 821. Los coreanos tendrán sus razones para apostar por el viejo conocido.  Los 4GB de RAM se han establecido en todos como la resolución 2K, con la excepción de que no nos encontramos discrepancia ninguna en este sentido. Con una buena optimización del sistema operativo debería ser suficiente para aportar una buena experiencia; no parece necesario todavía apostar por barbaridades como los 6 GB de memoria RAM. Por otra parte, en el tema de las memorias internas nos llevamos una grata sorpresa. Después de haber vivido un tiempo en el que estaban casi desaparecidas en la gama alta, podremos volver a usar microSD para ampliar la memoria en todos. Esto es de especial importancia en el LG G6, al sólo tener 32 GB de memoria interna.  Sin embargo, algo en lo que no se llegan a poner de acuerdo es la cámara. En el LG G6 y en el Huawei P10 nos encontramos dos lentes, una combinación que lleva cobrando popularidad desde el año pasado. Pero los nuevos Samsung y el Xperia XZ siguen apostando por utilizar una única lente, aunque parta con mejoras significativas. Tendremos que esperar a las comparaciones de cámara para ver quiénes llevan razón.  En batería todos también andan bastante parejos. Nos encontramos una media de 3.300 mAh entre todos, con un mínimo de 3.000 mAh del S8 y un máximo de 3.500 mAh del S8 +. Pero, como muchos sabéis ya, lo que de verdad importa es cómo de bien esté optimizado el consumo de batería. Y tendremos que esperar a las pruebas de campo para emitir un veredicto final. Por último, nos toca hablar de lo que determina si nos podemos hacer con un teléfono o no. Sí, estamos hablando del precio. El más barato es Huawei, seguido muy de cerca por LG. Los Samsung suben 100€ y 200€ el precio del LG G6, respectivamente. Y, aunque no conocemos el precio oficial del Xperia, es de esperar que ronde el de los Samsung. Me gusta lo qu eha sacado Samsung pero me seduce mucho más el LG G6 por el gran angular, menor grosor. El xz premium es superior que todos, es el unico con doble altavoz stereo una camara que innova con los 960 fps, mejor pantalla y el mas completo, los otros son moviles aburridos que no aportan nada fresco Si tuviera otro diseño no estaría mal… Pero es 4K, por eso le gana al S8. El diseño de Sony tiene años siendo el mismo, no veo como eso no entra en sus puntos en contra. Los marcos superior e inferior deberían reducirlos un poco.  Los Ferraris,porches, Lamborghinis  tienen el mismo diseño siempre, es su seña de identidad, ademas para que quiere cambiar de diaeño si todos los años se lleva el premio de diseño en red dot adwars y fia. Los marcos sirven para meter altavoces stereo, sensor delantero de 13 mpx , cámara trasera de 19 mpx con gpu y que no salgan franjas negras asquerosas. yo no tengo idea de que puedes hacer con videos a 960fps, lo del doble altavoz tambien lo sacara htc con su nuevo modelo, y el sony pasará al olvido como siempre, deberían cambiar el diseño, los biseles son demasiado grandes Espera quien eres tu para decir que los.biseles son grandes o pequeños.
El iphone es el movil que mas vende y tiene mas marcos, osea que la gente los prefiere por  que son mas comodos en ergonomía para jugar y ver videos, y por tener sonido estéreo frontal.
Htc esta en la ruina, tienen igual o mas marcos que los Xperia, aparte que no da la talla Es una pena que con el S8 que tampoco es una maravilla sigue siendo el mejor terminal por ahora presentado. Mmm bonito diseño el del Samsung pero sigue sin convencerme… Sigo a la espera del Xiaomi Mi6 que, sin esperar que sea elegido móvil del año en ningún apartado, es el equipo que por relación precio/calidad, se lleva todas las de ganar a mi gusto… Al menos en lo que se ha filtrado. Espero pronto poder jubilar mi Xperia Z3 y poder pasar a un Mi6. Exactamente como yo. Esperando cambiar el Z3 por el MI6 ¿El S8 puede grabar 4k a 60fps? ¿Y la cámara lenta mejora respecto al s7?  Al final el xz premium salio primero con el snapdragon 835 y su cámara con grabación a 960 fps y pantalla 4k hdr les da largo al resto de marcas, se nota que el que escribe este artículo siente antipatía por Sony, lo que no me gusta es q desde hace algún tiempo Sony anda agrandando sus biseles superior e inferior Vamos señores de el Androide libre acepten la superioridad de Sony, al menos describan al xz premium, SUFRIDORES Hasta ahora para mí.. LG G6, a la espera del Xiaomi Mi6 Plus. Sí, yo estoy igual, no entiendo qué le ve la gente al S8 y S8 plus, lo respeto pero prefiero mil veces antes el G6. Me parece un pepinaco, y yo personalmente la pantalla curvada del S7 Edge la probé y la ODIO, sin mencionar que al ser tan fino el agarre no es el mismo. Me parece que despues del hype que se ha producido estos meses lo presentado ha sido un poco decepcionante, esto no es malo porque algo que es realmente bueno tampoco necesita una revolución. Lo decepcionante es que los medios de comunicación llevais meses diciendo que Samsung iba a poner toda la carne en el asador despues del caso Note y que iba a ser un terminal revolucionario con nuevas tecnologías y yo me he perdido algo de lo presentado, o no veo esa revolución por ningun lado, de hecho lo mas revolucionario de los rumores al final se han quedado en nada… Aun así seguirá siendo el terminal referencia en Android y el lider en ventas en la gama alta en Android, no creo que esto vaya a cambiar este año. no sois una fuente fiable, el Huawei no está a prueba de salpicaduras y no todos son usb-c 3.1 Da igual samsunetas, qué los pongáis de enfrente cómo si los ponéis del culo…. De todas formas os diré que todos juntos al lado del Sony Xperia XZ Premium, parecen tener algo de categoría 😉 😉 😉 😉 tontolabas os falto sacar la cagada del iPhone también… Correcion en el primer cuadro, el huawei P10 tiene su sensor de huella dactilar en la parte delantera. El Androide Libre / Blog de referencia Android en español.Noticias, aplicaciones, juegos, teléfonos móviles. Todo sobre Android el SO de Google: Nexus, Samsung, Root. Información Legal | Contacto El Androide Libre usa cookies para funcionar Aceptar Más info","<a href=""https://elandroidelibre.elespanol.com/2017/03/comparativa-galaxy-s8-lg-g6-p10-huawei-xperia.html"">Samsung Galaxy S8 vs LG G6 vs Huawei P10 vs Sony Xperia XZ Premium</a>"
" La última bestia japonesa ya ha sido bautizada como el mejor Android de Sony. Y hoy os enseñamos todo sobre la cámara del Sony Xperia XZ Premium. Sony, aprovechando el marco del Mobile World Congress 2017, nos ha presentado en sociedad a su último buque insignia. Estamos hablando del Sony Xperia XZ Premium, un dispositivo que tiene buena pinta. Snapdragon 835, pantalla 4K y HDR, batería de 3.220 mAh y Android 7.1. Sobre el papel no tiene muchas pegas aparentes, en realidad. Aunque quizás una de las piezas más destacadas sea su cámara. No sólo nos encontramos con 19MP y una apertura de f/2.3. También nos encontramos con un módulo de memoria dedicado en exclusiva a la cámara, la grabación de vídeo 4K, e incluso la grabación a 960FPS. Una barbaridad que os queremos explicar mejor.  Como os contamos en la presentación del dispositivo, uno de los aspectos que más destaca es la memoria integrada. Es decir, el sensor de la cámara incluye su propio almacenamiento de datos. Y, aunque parezca una tontería, esto nos abre las puertas a muchos trucos.  El primero es uno de los puntos fuertes que resalta Sony al vender su Xperia XZ Premium: la grabación de vídeo a cámara lenta, siendo capaz de llegar a 960 FPS. La velocidad normal de la cámara lenta de un teléfono suele ser 120 FPS. Por lo que Sony habría sido capaz de cuadruplicar la velocidad en su cámara. Eso sí, la velocidad tiene un coste: sólo puede hacerlo seis segundos seguidos y a 720p. Otra de las ventajas de la memoria integrada es que, según Sony, la cámara puede digitalizar las imágenes cinco veces más rápido. Eso significa que, en fotos donde haya mucho movimiento, el Xperia XZ Premium conseguiría una imagen más nítida. El sensor sigue siendo un Exmor RS, y también afirman que han mejorado el procesador de imagen Bionz para detectar el movimiento y procesar las imágenes más rápidamente. Desde los Xperia X, Sony usa tecnologías de predicción de movimiento para sacar fotos bien enfocadas. Es decir, que un objeto que se mueva deprisa no nos estropee la foto. Y el nuevo Xperia XZ Premium no es menos, porque también cuenta con ello. Además del enfoque automático híbrido predictivo, que se encarga de anticiparse al movimiento, la cámara capta 1 segundo antes de que pulsemos el disparador. Cada fotografía genera 4 fotogramas, y podemos elegir el mejor fotograma 0 guardar los cuatro. Además, también nos encontramos tecnología para prevenir distorsiones en la fotografía, lo cual es de agradecer. Por otra parte, y entrando en un apartado más general, Sony ha equipado en el dispositivo su SteadyShot y estabilización de imagen de cinco ejes. Todo esto haría posible vídeos más fluidos, sin el típico tembleque que encontramos en las escenas movidas. También nos encontramos cosas a las que estamos más acostumbrados, como enfoque manual y control de la velocidad del obturador.  Todo esto es lo que trae la cámara del Sony Xperia XZ Premium sobre el papel. Lo único que nos queda es que pase por nuestras manos, para poder comprobar si todo esto es cierto. Eso vendrá en el futuro análisis, pero mientras os dejamos con una muestra que hemos tomado.  Ahora lo que falta es hacer fotos y vídeos y dejarse de chorradas.. Muy buena pinta a ver que tal el resto del teléfono y el precio La teoría acompañada de imágenes comerciales de Sony siempre queda muy bonita. Veremos a ver. Pues todo muy bien e “innovador” en celulares perooooo sony siempre ah tenido una pega y es su procesado de imagen, o salen muy blancas o salen con mucho ruido en las noches y predigo que va a seguir pecando de lo mismo por que con la apertura de 2.3 no da mucha esperanza…. Aqui el procesado de Sony humilla al del s7. https://photos.google.com/share/AF1QipNWPYzJr47Aud0BPlFL48xNqUK9gkRDqv1h-JHSd6TYJ-8uYbmUUCW88bFYTsOacg?key=emZUbXJQaWFnNFJwZWJvbUZRYXpGbmJTdFRPWERn Lo que pasa que a ti te gusta vet colores anaranjados e irreales. Aqui el procesado de Sony humilla al del s7. https://photos.google.com/share/AF1QipNWPYzJr47Aud0BPlFL48xNqUK9gkRDqv1h-JHSd6TYJ-8uYbmUUCW88bFYTsOacg?key=emZUbXJQaWFnNFJwZWJvbUZRYXpGbmJTdFRPWERn Lo que pasa que a ti te gusta vet colores anaranjados e irreales. No es apertura 2.3… Es de F2.0
El 2.3 es el tamaño del sensor… 1/2.3. Está mal. Este móvil sin duda es una insignia ? digna de adquirir y más con sus características que enamoran a todos los que nos gusta Sony  Para que luego cojan el sensor Samsung, Apple y LG y saquen mejores fotos que ellos Cuando no seas en tus sueños, xq los xperia siempre estan encima en dxomark Cuando no seas en tus sueños, xq los xperia siempre estan encima en dxomark wow este año va a estar buena la guerra quien le quitara el puesto al google pixel, sera sony, sera htc, sera samsung o sera apple El Androide Libre / Blog de referencia Android en español.Noticias, aplicaciones, juegos, teléfonos móviles. Todo sobre Android el SO de Google: Nexus, Samsung, Root. Información Legal | Contacto El Androide Libre usa cookies para funcionar Aceptar Más info","<a href=""https://elandroidelibre.elespanol.com/2017/03/camara-del-sony-xperia-xz-premium.html"">La cámara del Sony Xperia XZ Premium al detalle, impresionante</a>"
" La última versión del sistema Android ha llegado a los Sony Xperia XZ y Sony Xperia X Performance con su última actualización, Android 7.1.1 Nougat. Android vive pendiente de las actualizaciones, eso es un hecho. Ahora los ojos están ya puestos en las novedades que Google va a implementar en Android O y en el momento en que esa versión llegue a nuestros móviles. Sin embargo son muchos los terminales que aún no tienen la última versión de Android, Nougat, en su revisión 7.1.1. Y esta es exactamente la actualización que están recibiendo los dueños de dos modelos de Sony, los Xperia XZ y los Xperia X Performance.  La espera para tener una mejor versión del sistema ha acabado para los dueños de estos modelos y es que Sony Mobile ha liberado el firmware, que tiene un número de compilación 41.2.A.2.199. Uno de los aspectos más curiosos es que la característica de Android 7.1.1 que introduce los accesos directos en los iconos de los escritorios no está disponible en el launcher de Sony pero si instalamos otro compatible sí que podremos utilizarlos. Además el fabricante ha aprovechado el lanzamiento de esta actualización OTA para difundir también el parche de seguridad del sistema correspondiente al mes de abril de 2017. Algunos usuarios que han instalado esta versión en sus móviles comentan que ahora la cámara funciona de manera más rápida, algo que es aplicable al rendimiento del móvil en general y que también tienen nuevos iconos en algunas aplicaciones. Por el momento no se han visto las OTAs distribuidas a nivel mundial, sólo en algunos países, pero es lógico esperar un despliegue progresivo para que si hay algún problema de última hora se pueda corregir antes de que afecte a demasiados usuarios. Al menos lo han recibido antes de que salga Android O. Mi tablet Z2 recibió Marshmallow varios meses después de haber salido Nougat. Mientras tanto esperando la última 7.0 en mi Xperia Z5…la fragmentación sigue siendo el gran problema de Android El Androide Libre / Blog de referencia Android en español.Noticias, aplicaciones, juegos, teléfonos móviles. Todo sobre Android el SO de Google: Nexus, Samsung, Root. Información Legal | Contacto El Androide Libre usa cookies para funcionar Aceptar Más info","<a href=""https://elandroidelibre.elespanol.com/2017/04/android-7-1-1-nougat-llega-los-sony-xperia-xz-xperia-x-performance.html"">Android 7.1.1 Nougat llega a los Sony Xperia XZ y Xperia X Performance</a>"
" Sony también está preparando nuevos móviles de gama alta y parece que por fin vemos fotografías del sucesor del Sony Xperia XZ. Sony es una empresa que ha pasado de tener un papel muy relevante en Android a quedar parcialmente relegada de la primera plana. Sin embargo eso ha ido de la mano con una recuperación en los ingresos por parte de su división móvil, señal de que lo está haciendo bien. Parte de esa nueva etapa consistió en reducir el catálogo de móviles y centrarse en la gama alta, algo que aumenta sus beneficios sin tener que vender más. Por eso no es de extrañar que empecemos a ver filtraciones y rumores del nuevo modelo que vendrán a sustituir al Xperia XZ.  Las fotografías que se han filtrado incluyen algunos modelos actuales de la empresa como el Sony Xperia XZ o el Xperia Z Ultra pero también hay un desconocido que viene con más RAM de la cuenta. En concreto este modelo sería el Sony Xperia XZ2, o eso indica la fuente desde Weibo, y una de sus novedades, al menos dentro del catálogo de Sony, sería el usar 4 GB de memoria aleatoria.  Otros aspectos quedan como en su antecesor, como la posición del sensor de huellas en el lateral del móvil, en el propio botón de encendido, algo que parece seguirá siendo seña de identidad en la empresa. En la misma fotografía vemos una pequeña pegatina que tiene dibujadas son tarjetas SIM ¿podría ser este un modelo DualSIM?.  De cualquier forma parece que el diseño de Sony sigue siendo bastante conservador y que no habrá una disrrupción en ningún aspecto, a no ser que por fin decidan poner en orden su departamento de imagen y dotar a sus móviles de un procesado a la altura de sus sensores. Ese es el x2, pareceis novatos, el XZ 2 no se presentará hasta septiembre. Parece que no conoces a la buena de Sony Por eso que la conozco,.No va a sacar un xz 2 con un helio p20. Y los gama alta los sacará en septiembre igual que el año pasado. Dónde aparece que vaya a llevar un Helio P20? Además no van a hacer el X2 con tanta RAM.
Sony siempre renueva su gama alta tanto en septiembre como en febrero. Si las imágenes son reales, los encargados de diseño en Sony no se merecen cobrar su sueldo. Memoria aleatoria, hace tiempo que no leia eso xD El Androide Libre / Blog de referencia Android en español.Noticias, aplicaciones, juegos, teléfonos móviles. Todo sobre Android el SO de Google: Nexus, Samsung, Root. Información Legal | Contacto El Androide Libre usa cookies para funcionar Aceptar Más info","<a href=""https://elandroidelibre.elespanol.com/2017/02/xperia-xz-2-fotografias.html"">El Sony Xperia XZ2 podría ser el móvil filtrado en estas fotos</a>"
" Los últimos datos apuntan a que habrá tres versiones del Xiaomi Mi 6, con una cámara similar a la del Sony Xperia XZ Premium y que tendrá precios contenidos. Cuando casi todas las grandes empresas del sector móvil, con la excepción de Samsung, han presentado sus propuestas para la gama alta es Xiaomi la que empieza a acaparar más atención ya que el Xiaomi Mi 6 podría estar más cerca de lo esperado. Los últimos rumores nos dan datos sobre su fecha de presentación, sus posibles versiones en cuanto a almacenamiento y memoria RAM, sus precios y también sobre su cámara, que se podría parecer a la más interesante de las que se han mostrado en el MWC. El día elegido sería el 16 de abril en una presentación en China ya que no parece que la empresa vaya a cambiar su política de internacionalización con este modelo.  Todas tendrían en común la presencia del Snapdragon 835 aunque esto se contradice con otros rumores que hablan de que también habrá versiones con el Mediatek Helio X30, seguramente para los modelos más económicos. La cámara sería similar a la del Sony Xperia XZ Premium aunque como sabemos que tenga el mismo sensor no implica que haga las fotos igual. Ni los vídeos en este caso. La pantalla sería de 5.2 pulgadas y si bien no sería curva sí que contaría con cristal 2.5D como tiene por ejemplo el Xiaomi Mi 5S Plus.  Este modelo llegaría al mercado en tres versiones en función de la memoria RAM y el almacenamiento. Habría una de 32 GB de memoria y 4 GB de RAM, otra de 64 GB de memoria y 4 GB de RAM y otra de 128 GB de memoria y 6 GB de RAM. Este último modelo contaría con acabado cerámico similar al del Xiaomi Mi 5 negro o el Xiaomi Mi MIX. También empezamos a saber cosas nuevas de los precios, que parten de los 1.999 yuanes, unos 275 euros para el más barato y de unos 2.499 yuanes, unos 345 euros para el más caro. Como siempre las filtraciones y rumores hay que cogerlos con cierto cuidado. En este caos nos parece extraño que Xiaomi apueste por 32 GB en su flagship aunque sea para recortar en la medida de los posible el precio del dispositivo. Por otro lado no se ha vuelto a mencionar el que la pantalla venga con resolución FHD o QHD. Como siempre decimos hay que andar con pies de plomo en este campo, y por descontado si nos equivocamos en alguna afirmación lo corregiremos lo antes posible. Sigo esperando el equipo… Realmente me interesa saber las prestaciones de la versión de 128 con acabado cerámico =) Pues no creo que sea ningun secreto, lo estándar para la gama mas top china, S835 y 6 GB de RAM Seguro, pero me refiero a que espero saber todos los detalles del equipo. Sin embargo, es muy probable (diría seguro) que sea mi próximo móvil =) Eso significa que el One plus 5 de este año tendrá un camarón de la isla Yo estoy pendiente porque tengo ganas de comprarme un móvil con unas cámaras tanto interna como externa realmente buenas.. Sólo por darle en la cabeza a los de iPhone. xd
Estoy pendiente del mi6, lo que saque OnePlus e incluso opciones más económicas como el UMI Z Pro si cumple lo que promete… El mi 6s tendrá mejor camara aún y saldrá en 6 meses mas XD Ya me tarda demasiado… hahaha!
Mi idea es comprar un móvil nuevo “pronto”, tenerlo para el verano. Por 300 euros vas a tener una mierda, si el mi mix cuesta  700 y tiene una mierda de camara imagina en un movil de 300 se ve que no tienes ni puta idea de lo k hablas Te darias mas likes, pero no puedo La cámara del Mi5S es excelente, en el Mi Mix estás pagando un movil conceptual de tirada mas limitada de lo normal, de ahí el precio, pero el sensor de camara no es nada del otro mundo. Sony siempre da la exclusiva de su sensor móvil tope de gama a los Xperia, por lo menos una generación, por lo que dudo que sea cierto Yo creo que la clave está en que, tal como pone, la cámara sería “similar”, pero no igual. Tal vez es una versión inferior del mismo sensor, un sensor con memoria integrada pero distinto…
Habrá que esperar para conocer más. Bueno dicen similar, con eso podrian referirse a que podria grabar a camara super lenta tambien, pero con otra tecnologia de menor alcance. El Androide Libre / Blog de referencia Android en español.Noticias, aplicaciones, juegos, teléfonos móviles. Todo sobre Android el SO de Google: Nexus, Samsung, Root. Información Legal | Contacto El Androide Libre usa cookies para funcionar Aceptar Más info","<a href=""https://elandroidelibre.elespanol.com/2017/03/la-camara-del-xiaomi-6-seria-similar-la-del-xperia-xz-premium.html"">La cámara del Xiaomi Mi 6 sería similar a la del Xperia XZ Premium</a>"
