content,title
" Continuamos con el Mobile World Congress 2017, en el que los fabricantes están presentando sus nuevos móviles para este año. Ahora es el turno de Sony, que nos muestra su Sony Xperia XZ Premium, la nueva apuesta de Sony en la gama alta.  Cuando Sony cambió de rumbo algo se perdió por el camino. Uno de los teléfonos que más nos gustó de su anterior generación fue el Xperia Z5 Premium, el primer teléfono del mundo con pantalla 4K. El Xperia XZ Premium llega al mercado para recuperar su esencia, con interesantes novedades que van más allá de su pantalla. Nos encontramos con un cuerpo con marcos de aluminio y trasera de cristal, en el que destaca el estilo visual que nos impresionó ya en el anterior modelo Premium de la marca, y es que la parte trasera es prácticamente un espejo. En sus especificaciones nos encontramos sorpresas, y es que la compañía nipona si que ha apostado por el nuevo procesador de Qualcomm, el Snapdragon 835. El resto de especificaciones son las siguientes: 
		
		  Uno de los aspectos en los que más destaca el Xperia XZ Premium es en su cámara, y es que no son pocas las innovaciones que vemos en el sensor. Para comenzar, se trata del primer sensor fotográfico del mercado que incluye memoria integrada. Este avance nos permite tener nuevos avances. El más significativo es sin duda la grabación a 960FPS, un modo de grabación en camara ultralenta que solo es posible realizar gracias a estos avances. Por razones técnicas, solo es posible capturar video ultralento en calidad 720p durante 2 segundos. Por otro lado, tenemos la captura predictiva. Cuando abrimos la cámara, el sensor va tomando fotos en máxima resolución y guardándolas en la memoria integrada. Cuando tomamos una fotografía, nos aparecerán los instantes anteriores de la captura, permitiéndonos quedar la que más nos guste. La última de las tecnologías se trata de una especie de barrido de imágenes más rápido de lo habitual que nos permite conseguir que cuando fotografiamos objetos en movimiento, estos no salgan distorsionados. El Xperia XZ Premium incluye una cámara puntera en todos los aspectos El Sony Xperia XZ Premium llegará al mercado a lo largo de primavera de 2017. Respecto al precio aún no tenemos novedades, pero podemos asegurar que no se tratará de un dispositivo asequible. Marcos superior e inhferior enormes que hacen que el teléfono sea enorme y estéticamente desfasasdo
Estando el LG G6 y el Galaxy S8, no creo que este se venda mucho. La cámara parece golosa, pero habrá que ver si no se vuelve a quedar un paso por debajo de Samsung y compañía. Los marcos es cierto que deberían de apurarlo un poco más… Marcos asquerosos ,diseño continuista que ya aburre a mas no poder
todavia peor seguir metiendo las botoneras de home y back  dentro de la pantalla desaprovechando el marco inferior  por lo unico bueno que tiene este sony , es la camara , pero por todo lo demas
ni drogado me compro un sony este movil definitivamente incluso ni asusta al LG G6 ,ni a los S8 de samsung ni a lo que vaya a sacar Huawei  Llamenme raro pero a mi me gusta más este que el lg g6 Raro :v Inteligente raro sería comprar un móvil gama alta a sabiendas que antes del año le da muerte súbita. El resto del telefono normalito pero la camara tiene pintaza. Lo de los 960fps es impresionante. Es impresionante, sí. Pero solo por dos segundos y a 720P :/ Para tomar un pequeño video de algo no esta mal. Lo que no tengo claro es si son 2 seg de video o 2 seg de tiempo real. Si es lo segundo esta genial. Lo de 720p es verdad pero ya esta bastante por encima de lo que ofrece cualquier otro telefono y supongo que permitira a mebos fps pero a 1080p Con lo que ha sacado LG y lo que presentará Samsung el mes que viene, los teléfonos con estos marcos (y aquí meto a los Sony pero también a los Apple) parecen algo tremendamente anticuado. Les puede hacer mucho daño, la estética es un punto vital en la gama alta. Everything becomes wow when you see that frames. El móvil tiene pinta de estar genial pero no entiendo lo de esos marcos en los que podrían aterrizar aviones, y más teniendo en cuenta lo que viene con Samsung y LG Venía a comentar que una vez más Sony con el mismo diseño y blabla pero me volví a enamorar de lo conseguido que está.
Sí, no tiene los marcos más pequeños del mercado pero está diseñado para lucir elegante por donde lo mires además de un hardware impresionante. Si yo no viviera en Venezuela y tuviera la posibilidad de pagar por un gama alta elegiría este sin dudarlo mucho. Derroquen a Maduro :v Sony repite diseño de nuevo, como no!,.. es para cantarle la canción de Tamara..”no cambié, no cambié, no cambié…” En fin, al menos van estrechando los biseles laterales porque el superior e inferior nada de nada!. Pero bueno, al menos han conseguido llevarse los focos de atención por ser el primero en tener el SD 835… entonces Samsung mentía diciendo que iban a ser lo primeros en tenerlo no?… No dudo que la cámara de éste Sony sea genial, lo será seguro, pero habrá que compararla con la que trae el S8… curioso que ninguno de los dos opte por doble óptica… y el que grabe vídeos 720p a 960FPS por sólo 2 segundos creo que se queda muy corto y no será muy aprovechable, creo que Samsung llegará mas allá y ofrecerá una cámara lenta mejor.
Y la trasera de espejo… para lo más narcisistas!.. me parece simple repetir de nuevo ése acabado.
Pero bueno, lógico que será un buen gama alta por sus especificaciones. Espero que la cámara del S8 sea mejor que esta, más bonito quizá sea el nuevo Samsung, eso depende de quien lo mire, hay gente que ve bonito un iPhone… Lo dicho, espero, porque si no llega a ser mejor mi estimado fanBoy se va a quedar ud con los dientes largos, no es fácil superar esta cámara por mucho que ud piense que es poco aprovechable esos 2 segundos. Piense que gente con mucho menos ha hecho cosas extraordinarias, habrá que ver que hace la muy creativa comunidad. Saludos desde mordor  Una función de grabación de cámara lenta por muy alucinante que sea el resultado por sólo 2 segundos y en resolución HD 1280×720 pixeles no me parece suficiente reclamo para gastar 800 ó 900 euros si el resto de cosas lo puede hacer igual o mejor otros smartphones que cuestan menos y son más bonitos y ergonómicos que los Sony. Nadie se pasa el día ni las semanas enteras grabando a cámara lenta, es por ejemplo mucho más útil hacer fotos de gran angular como las que hace el G6 y seguro que saldrá a un precio bastante más bajo que el XZ Premium. Sony no es para ti
No cubres el presupuesto mi chavo
Sigue con tus xiaomi y Lenobo Por supuesto que Sony no es para mi porque tengo un S7 Edge que está bastante por encima de cualquier Sony, empezando por la pantalla y terminando por el procesador, pasando por un mejor diseño y procesado y lentes fotográficas. Hace bastante tiempo que los surcoreanos han adelantado a los japoneses, amiguete!.
Qué te ha llevado a pensar que yo uso un Xiaomi o un Lenovo (con “v” no con “b” por cierto),… creo que tienes que hacer un ejercicio de informarte mejor antes de abrir el pico. Yo a mi parecer veo más utilidad en una cámara que tiene muuuchas opciones (ya depende de quien la exprima o no) que una pantalla muuuy bonita que es curva y nada más, se ve bien pero se te puede quemar por ser amoled o super amoled o lo k kieras, viene en un formato INÚTIL llamado 2K, además que a la mínima que seas un poco torpe te vas a pasar el día tocando los borde curvados, bordes que te quitan calidad de multimedia puesto que no aprovechas la pantalla al completo,  por cierto, Sony peca en el tamaño de los bordes tanto superior como inferior, pero a cambio te da unos excelentes altavoces ? frontales estéreo de muy buena calidad (la calidad es discutible pero siempre será mejor k el altavoz mono de cualquier Samsung de tropecientos mil euros) y no te olvides que el panel es 4K, por menos de lo k cuesta tu Samsung te compras un Sony más completo… Dedicate a meditarlo un segundo, eso sí, más bonito no será, pero elegante es un rato, por cierto mantenga la calma y la educación y no diga que el compañero que le respondió tiene “pico”, la opinión de el será igual de válida que la suya o la mía  Perdona,.. insinúas que la cámara del S7 no tienes opciones?… por favor,.. creo que no la has visto ni tocado; yo en cambio sí he visto y comparado ambas y todas las demás puesto que.. soy fotógrafo profesional y se perfectamente donde está lo bueno, ok?, además… para el S7 – S7 Edge tienes las LENS COVER que es una carcasa con dos lentes adicionales una gran angular de 108º y un tele de 2X aumentos, o sea… tienes la segunda cámara del LG G5 o G6 de gran angular o la del IPhone de 2X aumentos todo en uno con éste set oficial. Y esto amigo mío que yo sepa no lo ofrece Sony o no lo tienen los últimos modelos Xperia XZ de Sony, sí que han tenido una lentes muy complicadas de poner en los antiguos Z pero no han progresado. En cambio Samsung a dotados con éstas Lens Cover de todo lo que te hace falta para al S7 sacar el máximo partido de forma extremadamente sácil y cómoda puesto que la carcasa se la puedes dejar puesta y poner en un segundo cualquiera de las dos lentes que son pequeñas y nada aparatosas.
Y dicho esto te puedo asegurar que he sacado tanto partido del S7 Edge con sus Lens Cover que hasta he vendido una de las cámaras de fotos que tenía!. Por algo será.
Mira, en realidad por muchas comparativas, etc.. del año pasado si hay un móvil con una cámara intachable, perfecta y con todas las posibilidades posibles.. ésa es la del S7 y éste año veremos que pasa con el S8, pero… el último que ríe… siempre ríe mejor.
Otra cosa,.. el Z5 Premium su pantalla operaba en 4K sólo si reproducías vídeos o contenidos en 4K, el resto del tiempo opera en FullHD, así que no se le sacaba partido, en el XZ Premium ya sí está más aprovechado, pero las pantallas de Sony dejan bastante que desear junto a las Super Amoled de Samsung, sean Edge o no, los surcoreanos son insuperables en éste campo y es importante?.. sí y mucho, sobre todo si quieres ver muy bien las fabulosas fotos que puedes llegar hacer.
Y por último, no se puede defender ya a éstas alturas que el diseño de los Sony aburren y mucho, sin optimizar los marcos de la pantalla a estas alturas y repetir tanto ése diseño tan cuadrado con aristas que denotan sumamente su volumen en cualquier bolsillo.. sinceramente… si alguien tiene que hacer un ejercicio de replantearse un mejor criterio de donde está lo mejor en móviles.. ése eres tú. Muy bien, me has convencido,  me compraré un Samsung con pantalla 2k, k muestra fotos con colores falsos, con altavoz mono y de paso me compraré accesorios a parte para poder compararlo con algún iluminado que me kiera vender un Sony. Así me kitare cositas tan inútiles con el botón dedicado a la cámara, la radio FM, el mini jack de 3,5, etc, etc, etc… Gracias por mostrarme la Luz.  Tu única razón: el altavoz; es cierto que el Sony como el HTC tienen altavoces estéreo y el Samsung no, eso no quiere decir que tanga un audio malo, sólo que no tiene ése doble altavoz, pero suena suficientemente bien, para mi suficiente y para mucha gente que para escuchar música preferimos lógicamente un equipo HIFI o de música dedicado no un móvil que por mucho altavoz estéreo que tengan… poca potencia alcanza, solo para ciertas ocasiones; con lo cual es una condición la que defiendes poco relevante al lado de otras que sí son mucho más útiles.
El botón dedicado para la cámara es un pequeño detalle que si quieren todos los fabricantes lo pondrían en su móvil, si no lo hacen será por que tampoco es relevante o tan útil, ya que hay varias maneras de hacer la foto,… tocando simplemente la pantalla ó diciendo alguna palabra, etc..
Resolución 2k k..?.. de qué sirve tener 4K si luego los ángulos de visión y los negros no llegan ni de lejos a los que tienen las pantallas SuperAmoled?….
Y.. qué colores saturados?… se nota que no has tenido una SuperAmoled en tu vida, porque si no sabrías que en el menú de pantalla hay modos diferentes para bajar y variar la saturación, además con Nougat el S7 puede llagar a graduar totalmente los colores y hasta dejar la pantalla en blanco un negro,… teniendo siempre en cuenta que el negro de una pantalla SuperAmoled es un negro profundo donde el pixel no recibe luz, está apagado con lo cual hay un ahorro de energía que tus queridas pantallas IPS de Sony que ni si quiera las fabrica ella… no tienen.
Radio FM para qué?… eso es para las abuelas! jajaja…
Mini Jack claro que hay!… qué te hace pensar que no?.. eso no lo tiene el IPhone! majete…
Bueno,… creo que te he vuelto a poner de vuelta y media, no? jajaja… Hola de nueve majo, esta vez te voy a ser algo más k sincero!! Es verdad me has dado vuelta y media, si señor!! Me he tenido k sentar para poder resposderte.
Se me kedo un poco desencajada la cara de la hostia k acabas de darme señor fotógrafo profesional,  haciéndome leer que: “el botón de cámara es un detalle poco relevante o poco útil”
Si un “fotógrafo profesional” no defiende ese pequeñísimo detalle y más sabiendo k el móvil cuesta entre 800 y mil y pico euros… Por ese dinero por mi como si le ponen una cafetera!! En cuanto al sonido estéreo, vuelvo a lo mismo, por ese dinero kiero lo quiero todo!!. Es verdad que por muy HiFi que sean los altavoces muy buen oído has de tener para notarlo (te lo dice un técnico en sonido, telecomunicaciones,  audiovisuales además de imagen y sonido y si todo ello separado) Y al decir todo me refiero a k la salida de auriculares es tambn HiFi,  y además tiene soporte LDAC, para que continúes disfrutando del HiFi vía Bluetooth. En resumen un equipo HiFi portátil.
El 4K sirve para lo mismo que tu 2K, es decir para mostrar koen la tiene más grande, con un claro ganador, porque si no es por la RV no te sirve para nada en un panel así, otra cosa si te robas 2 minutos de mirar fabricantes de paneles te encontrarás con algo que se llama Japan display que es kien fábrica los display de sony y curiosamente Japan Display la conforman SONY, Hitachi y Toshiba,  en resumen Sony fábrica sus propios paneles.
Saturación: Más de alguien muy cercano a mI tiene Samsun y gran sorpresa se han llevado al ver sus lindas fotos en otra pantalla y sorpresa!!! No se ve tan guapa. Resulta que la foto no trae esos colores en si, sino k la mitad es del panel… Nadie se keja de eso de las fotos de sony, al contrario si algo alaban es la naturalidad de sus colores en el producto final.
Luego resulta que para ahorrar batería tengo que poner la pantalla en blanco y negro, más negro k blanco… No puedo en.lcd pero afortunadamente existe un gestor de batería llamado modo stamina que los que entienden.mejor que yo dicen k es la hostia!! Sin perder color ni tener que andar apagando pixeles..
Radio FM, muuucha gente k consume Samsung la reclama, serán todos unos anticuados entiendo…
Y por último lo del 3,5 lo digo por los rumores del S8,
Si necesitas más aclaraciones…you know ;) Si señor, soy fotógrafo profesional, diseñador creativo  multiplataforma (manejo TODOS los programas de diseño de todo tipo) con 30 años de experiencia, músico compositor y productor musical con home Studio propio y dibujante ilustrativo artístico.Como te quedas?… Muerto, verdad?. Sinceramente, por mucha verborrea que sueltes como comprenderás no podrás convencerme con tus flacos criterios, pero te dedicaré un poco más de mi tiempo de oro a contestar a tus pataletas de niño pequeño.
El botón físico para hacer fotos se agradece, pero no es indispensable bajo mi punto de vista porque valoro otras muchas cosas, así que si el S7 Edge no lo tiene me da exactamente igual porque el resultado de las fotos es superior gracias entre otras cosas al formato RAW, cosa que Sony no ofrece. Sabes lo que es el formato RAW?… pues el formato fotográfico profesional para fotógrafos profesionales por excelencia y tu querido Sony NO LO TIENE.
Pero eso sólo es un puto negativo de tantos otros, porque lo que expones por no reconocer que las SuperAmoled son superiores a los paneles japoneses es de niño pequeño, además Japan Display  efectivamente de no ser sólo Sony… Sharp que
es también japonesa para mi sus paneles IGZO son mejores que los de Japan Display. Y dile a tu amigo que si no ve bien o no sabe ver sus fotos en su Samsung es que tiene problemas daltónicos, porque tela!.
Ni modo Stamina ni leches majete, cada marca tiene su propio optimizador de batería igual de bueno o más que el de Sony y no les hace falta ponerle un “nombrecito”, mi S7 Edge sin ni si quiera activar su modo de economía energética me puede llegar a durar 3 días!! Con un uso normal!,.. claro.. es que tiene 3.600 mAh cosa que… qué Sony de gama alta tiene eso???… ninguno.
Y sí, la radio FM es de abueletes, aunque yo tenga 30 años de experiencia trabajando aún soy joven!.. será que empecé muy pronto, pero si quiero escuchar radio… hay multitud de formas de escuchar música por internet.
El S8 tendrá mini Jack 3,5.. es que no has visto las cientos de fotos que hay ya de él antes de su presentación?… que vives en un burbuja opaca o es que no sabes distinguir el agujerito en las fotos?…
En fin,… ponerte de vuelta y media no es darte hostias, es… demostrar que el que sabe …sabe y por tanto más te vale callas y aprender o al menos no atreverte tanto a meter la pata más si sabes de sobra que no tienes razón.
Ale, sigue con tu defensa a ésos “tacos” rectangulares y angulares de Sony con diseño desfasado y aburrido que por cierto… es lo peor que tienen.
CIAO!. Aún y te has quedado corto para ser un cincuentón con el callo hecho en un sentido, yo lamentablemente ya no tendré más tiempo para decirte que tus paneles de Samsung sean buenos o malos, solo te diré para despedirme que en el mundo de la imparcialidad nadie dice k Samsung es la dirección a seguir. Lo alaban a la vez k ven sus flaquezas, cosas k desde puntos de vista como el tuyo por ejemplo, nunca se podrán ver en estereo. Un atento saludo. Por cierto, todo siempre desde un Z5 PREMIUM con sus Pros y tambn con sus contras!!  Ja ja ja… pues no tengo ni mucho menos 50 años!,.. hiciste mal las cuentas. Me queda bastante para ésa edad y además aparento bastante menos de los que realmente tengo. Y para rematar… además de ser todo eso que te he dicho y tener tan larga experiencia he sido modelo, si, si.. modelo! de pasarela y publicidad, podrás imaginarte entonces si me he cuidado para “retener” mi edad y llevarlo… posiblemente mejor que tú… jejeje.
No digo que Samsung sea perfecta, pero en los últimos 2 años ha dado un salto considerable para conseguirlo y está cada vez más cerca de ése objetivo, al menos va apostando por un concepto mejorado en diseño y progresando en tecnología donde es también la reina en fabricación de procesadores. Sony aún está bastante lejos de todo y lo sabes, si no es que no has leído o no te has informado lo suficiente antes de arremeter con argumentos confusos e incorrectos… lógico que te des cuenta de que has de retirarte de éste enfrentamiento y eso al menos te honra… ya era hora… jejeje.
Te dejo con tu Z5 Premium y su espejo trasero para narcisistas que no les importa verse en él con todas sus huellas pegadas.
CIAO!. Me alegro mucho por ti, aunque reconozco que me gustaría verte cruzando opiniones con serresiete (no te explico quien es por que seguramente serás un experto de cotrastada experiencia en ese tema tambn) para ver quien la tiene más grande y bella ya de paso. Poco narciso soy, elegí color negro, lo siento si te he decepcionado.  Mejor,.. el color negro es más disimulado, si no te interesa tener el espejito es porque.. no tendrás mucho que verte… jejeje… Jajajajaja ole tus huevos!!  Si señor, seguro que no eres serresiete? K empieza a hacerme ilusión y todo jajaja
Hasta logo bonito. Soy Maiki, ése que nombras ni puta idea majete. Según las pistas tan detalladas k me has dado es tu competencia y/o en su defecto tu referente. ALTO, GUAPO Y RICO, además de envidiado tambn conocido como Cr7 jajaja este año el S8 traera algo de espejo en su trasera, son todo ventajas para ti, ya no tendrás que envidiar a los “seguramente feos que compran Z5 PREMIUM con espejito”
De nuevo Adiós guapete!! ?? Ya no sabes ni que exponer, te pierdes como dice el dicho… “…te vas por los cerros de Úbeda”.
En fin, ahí te dejo con tus incongruencias…
Chaito!. Por cierto un favor a título personal.
Dado su elevado conocimiento en paneles móviles, mi estimado señor, podría ilustrarme acerca de los blancos entre una y otra tecnología? Lo digo ya que es el color que predomina en la vida de un smartphone.
Gracias de antemano. Pues mira.. sobre los blancos de mi S7 Edge decirte que.. con sus hasta …855 nits* su blanco deslumbra que… más claro imposible de ver y es graduable desde el modo de pantalla con un balance de blancos RGB…con el cual dejo ésos blancos como mejor me parecen!.. más.. un filtro azul para reducir la fatiga ocular. Todo eso y mucho más… en el S7 Edge.
* : unidad de medida de la cantidad de brillo.
CIAO! Que no se enteren el resto de consumidores de Samsung que les han vendido un galaxy falseta, que en vez de blancos muestran un amarillo casi blanco, eso sí con muchos nits jajaja. Bueno,  los consumidores y los periodistas analistas de tema que seguramente injustamente se quejan de aquello. Si Apple está considerando y planeando utilizar en su siguiente IPhone un panel Amoled o SuperAmoled… será por algo, no crees?.
Hay más criticas a favor que en contra de los paneles SuperAmoled, así que… deja de rebuscar donde poco hay que rascar. Pues ya tienes donde escoger el año k viene, entre un S8 o un nuevo iPhone,  lo digo dado que los que son “Altosh, guaposh y gicos (ricos, que seguramente lo serás, por k guapo y pobre sería putada para tu poco humilde ego) suelen llevar siempre algo así! Bienaventurado tú,  tu catálogo se expande.
Talogo bonito ?  Un IPhone no, gracias!, pero ya veremos cual es el siguiente, bien poco te importa, la verdad…
Y mi humilde ego tú hiciste que lo sacara…pues ahí lo tienes, puestos a quererse a sí mismo… yo, por supuesto que sí, no sé tú, pero si te cuidas y te quieres igual que lo mal que te defiendes tu poca lógica y razonamiento… que triste.
Rico en dinero no, pero sí en sabiduría.
Chaito!. Ok Maik, me beberé una ceverza a la salud de tu autoproclamada sabiduría y por k  no tambn a la salud de titanico ego (aparecido tras quedarte corto de argumentos, típico)!! Una palmadita en la espalda y buenos deseos para ti. Take care Bello ? Poco a poco has ido delatándote, el que no reconoce su torpeza sí que tiene un auténtico ego tal… que ni teniendo la evidencia delante… te crees que puedes hacer girar al mundo a tu favor…. va a ser que no; vendes fatal tu nefasto criterio y crees que puedes quedar por encima haciéndote el humilde… humilde las ganas tienes!, porque macho, dicha evidencia si no la quieres ver OK, pero deja de dar el coñazo y convence a otro que esté a tu nivel de raciocinio… escaso claro está.
Sabiduría,.. sí, la que podías tener tú si no insistieras tanto con tu ignorancia.
..jejeje que me quedo corto en argumentos dice,.. creo que no sepas ni lo que es eso, porque has tenido ya oportunidad de enterarte, pero una cabeza cuadrada.. es cuadrada, no hay más.
CIAO. Rotunto sí,  a todo lo k acabas de escribir, a TODO!! Mi cabeza cuadrada no me da para más, ya me he empapado demasiado por hoy de tu gran y bondadosa sabiduría a la par que de tus exitantes aventuras en pasarela, gracias de nuevo
Adiós guapete  No se trata de mi sabiduría, se trata de la sabiduría que está en la información y la lectura, ahí es donde está, lo pillas?… el problema de la envidia es la obsesión de querer tener sin hacer nada a cambio, en este caso se trata de aprender de lo que lees, no de imponer algo sin contrastarlo antes.
Fue un placer comprobar que tu intransigencia irracional te bloquea el saber más.
Espero que salgas de ése bucle.
Ciao. de un sí humilde informado que hace un esfuerzo en ampliar su conocimiento. Dos cosas señor, primero que nada no se trata de envidia, puesto que el teléfono que kiero es el k tengo y cuesta lo mismo que cualquier Samsung y de no ser así no tengo problema en pagar más por lo k me gusta. Eso por una parte.
Segundo puedes llamarme cabeza cuadrada y todo lo k tu autoproclamada brillante sabiduría te pueda dictar pero absolutamente nada de lo k aki has dicho me ha resultado información nueva, excepto claro está de lo guapo y buenorro k dices k estas… Y hasta ahora no recuerdo en k momento he dicho k un Sony sea mejor k nada, lo k si he dicho y te lo vuelvo a repetir es k los Samsung no son lo k gente como tú vende, buenos son y mucho según de donde lo mires pero eso de k es el mejor… Ni tu móvil ni el mio, y volviendo al tema principal me cuesta creer que un fotógrafo profesional diga que agregar semejante utilidad a la cámara de UN SMARTPHONE como lo es esos 960fps es algo inútil, será que Samsung lo ha hecho mejor o lo hará mejor, solo tu lo sabrás. Un saludo Quiero rematar ya tanta estupidez contigo porque eres de lo más absurdo que pare madre. Se nota que ya sea por cabeza cuadrada o triangular… sea como sea eres de los que ni aprende ni entiende nada porque vives muy en tu mundo de fantasía (en este caso el de tu amada Sony)… tú sigue ahí, viviendo en tu fantasía de tu Z5 Premium …monolito angular como ninguno y sí…. envidia!, no por no tener otro móvil que no sea ése taco cuadrado como tu cabecita… envidia la que tienes que no tener la razón ni saber ejercer la lógica y saber exponer ambas sin caer en lo más absurdo de los absurdos,… te has descubierto como un torpe aprendiz en tecnología que se cree más que nadie sin saber demostrarlo porque chico… afronta la realidad… no me llegas a ni a la suela de la punta del pié.
Cómete tu orgullo cuadrado y hermético porque nadie apoyará ninguna de tus tontas exposiciones porque son propias de un ignorante redimido.
Pero tu sigue defendiendo los monolitos de Sony.. no sea que con tan poca venta al final desaparezcan se sería lo más lógico,… lógico,… razón,… va!… no sabes ni lo que es eso.
Vive en tu mundo ése monolítico que es para lo único que vales, anda!.
CIAOOOO!!! Típico, no se k decir…. Pues insulto!!
Seguro k aún sabrás hacerl mejor Cual es el insulto?… cuando se habla de lo evidente es majete.
El que no sabe que decir eres tú, que desde el segundo comentario ya se te bloqueó ésa única neurona, la pobre está muy saturada.
Que… CIAO!!! Solo por curiosidad,  ¿qué edad tienes? Ja ja ja ja ja… me parto!… perdona pero esto no es un chat de hacer migas… Marikita: A que si fuera de gusanos ultraextrahermosos te fascinaría… Marikita: No te enfades, los gusanos ultraextrahermosos que tanto te fascinan y que tomas golosamente por todos los sitios no están en todos los lugares, de hecho, eres único hallándolos. Marikita: Olvídate de HTC y Sony, de sus pantallas no salen los gusanos ultraextrahermosos que tomas por todos los sitios. Prueba, mejor, los Galaxy S8. Marikita: Olvídate de los iPhone, de sus pantallas no salen los gusanos ultraextrahermosos que tomas por todos los sitios. Prueba, mejor, los Galaxy S8. Marikita: Olvídate de los Lenovo, de sus pantallas no salen los gusanos ultraextrahermosos que tomas por todos los sitios. Prueba, mejor, los Galaxy S8. Marikita: Olvídate de los XZ, de sus pantallas no salen los gusanos ultraextrahermosos que tomas por todos los sitios. Prueba, mejor, los Galaxy S8. Marikita: Olvídate de los XZ Premium, de sus pantallas no salen los gusanos ultraextrahermosos que tomas por todos los sitios. Prueba, mejor, los Galaxy S8. los marcos son cómodos para agarrar bien el teléfono sobre todo en modo horizontal, no veo cual es el problema Siempre le han criticado a Sony sus marcos superior o inferior, pero yo no sé por qué lo hacen… Recientemente he tenido un S7 de uso mientras reparaban mi móvil y sus marcos no son los más pequeños y nunca dicen nada, a comparación con un Z3 por pocos milimetros son más grandes y por su .1 más de pantalla lo hacen un poco más alto, pero de marcos nada.
Eso sí, este año yo hubiese esperado un poco menos de marcos, lo al nivel del Samsung o LG pero si un poco menos. Por cierto que en fotos se ven como más grandes pero en video o ya en la mano no es para tanto. justo tengo un note 5 y un z3 al lado y la manía de los marcos es estúpido cumplen su función cuantos telefonos tienen parlantes frontales … y al ser de esta forma es muy complicado taparlos con la mano como me pasa en el note 5 que sostenerlo horizontal es una odisea Así es, y poniendo en ejemplo a los Galaxys que “tienen mejores marcos”, principalmente es por efecto de sus esquinas más redondeadas, poniéndolos a la par de pantalla, sólo es unos pocos milímetros, que en la práctica no se notan. Siempre me a gustado tener de donde agarrarlo sin tocar la pantalla, en horizontal o para algo más. Aunque este año si hubiese preferido un poquito más chicos, al menos una cuarta parte de reducción.
 Y tienes razón, yo acostumbro a poner el dedo meñique como soporte del móvil al agarrarlo, en el S7 tapaba la bocina y era muy incómodo o acostumbrarse, pero al agarrarlo bien, sentía que se me podía caer. Son marcos enormes además que tienen las teclas de navegación dentro de la pantalla, es decir, tienes un celular de 5.2 pulgadas en un cuerpo de uno de 5.7 o 6 y eso en el uso vertical (el más común) es bastante incómodo.
Tengo el S7 Edge y no me parece nada difícil usarlo en modo horizontal y eso que veo mucho películas y juego bastante en mi celular. No digo que sean los márgenes más delgados pero al tener las teclas de navegación fuera de pantalla, aprovechas la pantalla sin tener que estar sacando las teclas a veces con dificultad cuando estás en pantalla completa, al final es cuestión de gustos.
Por cierto que tuve el Moto X Style con dos mega parlantes frontales y ni así usaba tantos marcos como los Xperia. Sí un par de milimetros se te hacen enormes (que los puedes medir) a comparación de los marcos del S7… Pues son tus gustos.
Y es absurdo comparar y decir que los botones en pantalla “comen pantalla” pues ya sabes que se esconden y lo único dónde te consumen espacio es al navegar… Pero son unas dos líneas que en la práctica no se nota. Y tampoco es nada de otro mundo ni difícil hacer un desliz para sacar los botones… Nunca he batallado con eso.
A ver si ahora al S8 le critican los botones en pantalla como lo han hecho con los demás, siendo que como no va a tener las bocinas en el frontal, se pudieron ahorrar los botones en pantalla y dejarlos como estaban. Se avecinan 700 pavos… Jajaja. Ojala no estés esperando este Sony por 300€ ;) 700? Jajaja pues algo más será, yo tengo el Z5 PREMIUM y me costó 800, teniendo en cuenta el salto que da en fotografía este pedazo de móvil no me extrañaría que se acerque a los 900, que dado el precio actual del mercado de smartphones no me resulta descabellado sin que eso quiera decir que no sea excesivamente caro (o caros todos).
Un saludo chavaleria y bravo ? ? Sony? Hola! Será que LG con su LG G6 lanzó este dispositivo con Snapdragon 821 sólo para la presentación en el MWC y tiene guardado  el SD835 para el día del lanzamiento? Por cierto, luce hermoso éste Sony, pero con esos marcos no creo que le hagan mella al LG G6 y al mismo SGS8, que de los tres opto por el de LG. Saludos y ojalá se cumpla lo que digo con respecto al SD835 para el día del lanzamiento del LG G6.  “Este avance nos permite tener nuevos avances” Cuando algo te resulta no hay que moverle nada, está claro que los marcos grandes y movil cuadriculado van enfocado a un nicho específico, le ha funcionado por 4 años desde el primer Xperia Z porque habría que cambiar la fórmula, no lo hizo en épocas de crisis menos ahora. a ver que sucede aqui primero que nada dejen aclarar varios puntos a los “chavales” milenials de hoy en dia, siendo un usuario de todas las marcas que han existido (hasta pantech tuve !auch!) en celulares desde que eran monocromaticos, a la edad de 36 sigo teniendo el privilegio de pasar por toda la evolucion de equipos celulares y formarme en programacion de pc asi que e experimentado de todo ya que soy bastante veterano en esto, en gustos se rompen generos dicen por ahi y a sony se le puede atribuir los marcos pequeños desde hace tiempo y muy atras ya que con el xperia ZL(que aun poseo y uso sin problemas hasta la fecha) metieron una pantalla de 5.1 en un frame (o estructura segun la region luego te crucifican por usar palabras extranjeras) que ni samsung ni lg pensaron en su tiempo, segundo nunca a existido mejor camara que la de los antiguos nokia, yo hice maravillas con el N8 con su sensor que parecia protuberancia del jorobado de notredame y su flash de xenon que podias usarlo como paralizador cegador contra ladrones y ni hablar del 808 (si señores existio un equipo y tenia 43mpx. o algo asi no recuerdo bien) acutalmente cambio constantemente de equipos ya que los reparo y lo vendo (pero el sony sigue igual que el dia 1) por lo cual una semana traigo un iphone 6s plus a la otra un galaxy s7 edge luego un huaweii  etc. etc. etc. y para ser sinceros las fotografias con tonos y colores mas reales de equipos actuales(no saturadas ni postprocesadas) las e tomado con la gama alta de sony, siento decirles ademas su ecosistema es muy interesante desde con un solo click prender un televisor bravia la playstation y accesar a tu cuenta de forma instantanea es bastante comodo por eso siguen desarrollando sus equipos basados en su filosofia y ecosistema todos sus articulos electronicos tienen semejanza y reconocimiento instantaneo ya sea nfc, smartlink, bluetooth entre otros de ahi la continuidad de su diseño por lo que dudo mucho que veamos un cambio drastico, eso solo sucedera cuando su producto alfa y todopoderoso PS4 tenga un cambio los omegas telefonos celulares que al parecer siempre es la ultima division de sony evolucionaran por lo que si lo demas es cuadrado los olvidados tambien lo seran jajaja, en fin dejen de quejarse y agarrenlo como si fuera volante para conducir o hagan retos de aterrizar aviones de papel en los navios de guerra. sony mencionó en su twitter que serían 6 segundos de grabación slow-mo https://twitter.com/SonyMobileNews/status/836206580504870913 Mega FAIL de Sony! Y dale con el 4K en pantallas de 5.5, qué desperdicio de batería y rendimiento, por dios. Si 2K me parece apenas justificable en ese tamaño, siendo Full HD lo ideal, con 4K me parece una tontería. Solo una palabra define a este equipo “Hermoso”  su estilo tan elegante y ejecutivo que cautiva con solo verlo ? Sony como siempre a un paso a delante de los demás. Los esclavos de Samsung siempre criticando los marcos pero Sony no está para complacerlo a los niños ?. El Androide Libre / Blog de referencia Android en español.Noticias, aplicaciones, juegos, teléfonos móviles. Todo sobre Android el SO de Google: Nexus, Samsung, Root. Información Legal | Contacto El Androide Libre usa cookies para funcionar Aceptar Más info","<a href=""https://elandroidelibre.elespanol.com/2017/02/sony-xperia-xz-premium.html"">Sony Xperia XZ Premium: características del mejor Android de Sony</a>"
